5,43,ハ,,数値制御工作機械で使われる準備機能(G)のコードとその説明(機能)の組合せとして、適切でないものはどれか。,"G00
指令した位置へ最大送り(例えば、早送り)で移動させるモード。(位置決め)","G01
一様な勾配又は制御軸に平行な直線運動を指定する制御のモード。(直線補間)","G03
工具の運動面をそれと直角な軸の負方向に見たときの工具の運動が円弧に沿って時計回りになるように制御する輪郭制御のモード。(時計回りの円弧補間)","G04
プログラムした時計又は主軸回転数だけ、次のブロックに入るのを遅らせる機能で、インターロック及びホールドではない。(ドウェル)","G91
ブロック内の座標軸をインクリメンタルディメンションとして与える指令。(インクリメンタルディメンション)"
5,44,イ,,"日本産業規格(JIS)における制御技術に関する記述中の(　)内に当てはまる語句として、正しいものはどれか。
あらかじめ定められた順序又は手続きに従って制御の各段階を逐次進めていく制御を、(　)という。",シーケンス制御,フィードバック制御,サーボ制御,フィードフォワード制御,カスケード制御
5,45,二,,日本産業規格(JIS)におけるテーパねじプラグゲージの有効径の測定において、必要としないものはどれか。,指示マイクロメータ,ころ及び補助板,ブロックゲージ,工具顕微鏡,四針
5,46,二,,日本産業規格(JIS)「工作機械-試験及び検査用語」における用語の説明として、誤っているものはどれか。,"平面度 
平面でなければならない機械部分の平面の幾何学的平面からの狂いの大きさ。","直角度 
互いに直角でなければ貼らない機械部分の直角からの狂いの大きさ。","真直度
直線でなければならない機械部分の幾何学的直線からの狂いの大きさ。","同心度
共通の軸線をもつように配置された二つの機械部分の軸線からの狂いの大きさ。","真円度
円であるべき部分の幾何学的円からの狂いの大きさ。"
5,47,ホ,,日本産業規格(JIS)における管理図は、統計的工程管理の基本的ツールであるが、その利用目的に関する記述として、誤っているものはどれか。,工程の偶然変動の大きさを推定する。,工程が安定状態を維持しているか否か、また、変動が小さくなっているか否かを判断するために、工程の現状を表すサンプルから得た情報と、偶然変動を反映させた限界とを比較する。,トレンド、連、周期などの変動パターンを検出することによって、工程の調節を支援する。,工程が予測可能な安定状態であるか否かを判断する。,工程管理システムの性能の評価を支援する。
5,48,ハ,,ねじの緩みに関する記述として、適切でないものはどれか。,ねじ締結体は、被締結部材同士の接合面に凹凸があるときは、締付け後に作用する外力によって圧縮力が変動し、局部的なへたりが進行して凹凸が平坦化し、ねじの緩みをきたす。,ねじ締結体が火災に遭って再結晶温度以上に加熱されるなど、機械類又は構造物が被災したときは、ねじが緩んでいないか疑ってみる必要がある。,陥没ゆるみは、軟らかい被締結部材を高強度ボルト·ナットで締め付ける場合に起こるので、軟らかい座金を併用すると防止できる。,ガス漏れを防ぐため、被締結部材同士の接合面にガスケットなどを挟んで締め付けるが、ガスケットなどに非弾性材料が混入されていると、外力の影響でへたりが進行し、ねじの緩みをきたす。,ハサミの回転軸に使われているねじは、おねじ·めねじ間に有効な回転抵抗を備えたナットにすることで、回転の繰返しによるねじの緩みを防止できる。
5,49,ロ,,日本産業規格(JIS)「工作機械–名称に関する用語」における用語の説明として、誤っているものはどれか。,"円筒研削盤
主として円筒形工作物の外面を研削する研削盤。","アンギュラ研削盤
といし台をテーブル案内面に対してある角度に設定し、主として工作物のテーパのある円錐面と端面とを同時に研削する研削盤。","万能研削盤
といし台及び主軸台が水平面内で旋回できる構造の円筒研削盤。","内面研削盤
工作物の穴の内面を研削する研削盤。","平面研削盤
主として工作物の平面を研削する研削盤。"
5,50,ロ,,材料に関する記述として、誤っているものはどれか。,ステンレス鋼は、耐食性を向上させる目的でクロム又はクロムとニッケルを含有させた合金鋼で、一般にはクロム含有率が10.5%以上の鋼である。,ステンレス鋼のうちオーステナイト系のSUS304は、フェライト系のSUS444に比べて応力腐食割れが発生しにくい。,炭素鋼は、鉄と炭素の合金で、炭素含有率が通常0.02~約2%の範囲の鋼であり、その炭素含有量によって低炭素鋼、中炭素鋼及び高炭素鋼に分類される。,機械構造用炭素鋼鋼材のS10CとS45Cでは、S45Cの方が炭素含有量が多い。,合金工具鋼は、炭素工具鋼に対して焼入性、切削性能、耐衝撃性、不変形性、耐熱性などを必要に応じて改善した鋼である。